"notation";"title";"description";"id"
"5.2.2.2";"nutzen ihr Wissen zu sprachlichen Gestaltungsmitteln für die Beschreibung und Untersuchung von (auch literarischen) Texten, Reden, Gesprächen und Formen digitaler Kommunikation.";"";"s9g"
"5.2.3";"Rechtschreibung";"";"f7s"
"5.2.3.1";"untersuchen Schreibweisen von Wörtern, Wortgruppen und Sätzen,";"";"e5u"
"5.2.3.2";"tauschen sich über die Schreibung von Wörtern und Sätzen, auch über orthografische Zweifelsfälle und die Interpunktion aus (z. B. Rechtschreibgespräch, Interpunktionsgespräch).";"";"d7p"
"5.2.4";"Aussprache";"";"x3u"
"5.2.4.1";"nutzen die Konventionen der gesprochenen Standardsprache weitgehend routiniert und situationsangemessen.";"";"v3e"
"5.2.5";"Ressourcen zur deutschen Sprache";"";"z9r"
"5.2.5.1";"nutzen Wörterbücher, Grammatiken, digitale Rechtschreibhilfen und Informationsangebote zum Deutschen (z. B. OWID, grammis) für das Nachschlagen von Schreibungen, grammatischen Verwendungsweisen und Verwendungskontexten.";"";"u6h"